,chapter_num,verse_num,verse,length,stemmed
3954,37,132,إنه من عبادنا المؤمنين,4,إن من عباد مؤمن
3955,37,133,وإن لوطا لمن المرسلين,4,إن لوط من مرسل
3956,37,134,إذ نجيناه وأهله أجمعين,4,إذ نجي أهل أجمع
3957,37,135,إلا عجوزا في الغابرين,4,إلا عجوز في غابر
3958,37,136,ثم دمرنا الاخرين,3,ثم دمر آخر
3959,37,137,وإنكم لتمرون عليهم مصبحين,4,إن تمرون على مصبح
3960,37,138,وبالليل أفلا تعقلون,3,ليل أفل عقل
3961,37,139,وإن يونس لمن المرسلين,4,إن يونس من مرسل
3962,37,140,إذ أبق إلى الفلك المشحون,5,إذ أبق إلى فلك مشحون
3963,37,141,فساهم فكان من المدحضين,4,ساهم كان من مدحض
3964,37,142,فالتقمه الحوت وهو مليم,4,تقمه حوت هو مليم
3965,37,143,فلولا أنه كان من المسبحين,5,لولا أن كان من مسبح
3966,37,144,للبث في بطنه إلى يوم يبعثون,6,بث في بطن إلى يوم بعث
3967,37,145,فنبذناه بالعراء وهو سقيم,4,نبذ عراء هو سقيم
3968,37,146,وأنبتنا عليه شجرة من يقطين,5,أنبت على شجرة من يقطين
3969,37,147,وأرسلناه إلى مائة ألف أو يزيدون,6,أرسل إلى مئة ألف أو زاد
3970,37,148,فامنوا فمتعناهم إلى حين,4,امن فمتعناهم إلى حين
3971,37,149,فاستفتهم ألربك البنات ولهم البنون,5,استفت ألربك بنت ل بنون
3972,37,150,أم خلقنا الملائكة إناثا وهم شاهدون,6,أم خلق ملأك إناث هم شاهد
3973,37,151,ألا إنهم من إفكهم ليقولون,5,أن إن من إفك قال
3974,37,152,ولد الله وإنهم لكاذبون,4,ولد الله إن كاذب
3975,37,153,أصطفى البنات على البنين,4,أصطفى بنت على بنون
3976,37,154,ما لكم كيف تحكمون,4,ما ل كيف حكم
3977,37,155,أفلا تذكرون,2,أفل ذكر
3978,37,156,أم لكم سلطان مبين,4,أم ل سلطان مبين
3979,37,157,فأتوا بكتابكم إن كنتم صادقين,5,أتى كتاب إن كان صادق
3980,37,158,وجعلوا بينه وبين الجنة نسبا ولقد علمت الجنة إنهم لمحضرون,10,جعل بين بين جنة نسب قد علم جنة إن لمحضرون
3981,37,159,سبحان الله عما يصفون,4,سبحان الله عن وصف
3982,37,160,إلا عباد الله المخلصين,4,إلا عباد الله مخلص
3983,37,161,فإنكم وما تعبدون,3,إن ما عبد
3984,37,162,ما أنتم عليه بفاتنين,4,ما أنتم على فاتن
3985,37,163,إلا من هو صال الجحيم,5,إلا من هو صال جحيم
3986,37,164,وما منا إلا له مقام معلوم,6,ما من إلا ل مقام معلوم
3987,37,165,وإنا لنحن الصافون,3,إن نحن صافي
3988,37,166,وإنا لنحن المسبحون,3,إن نحن مسبح
3989,37,167,وإن كانوا ليقولون,3,إن كان قال
3990,37,168,لو أن عندنا ذكرا من الأولين,6,لو أن عند ذكر من أول
3991,37,169,لكنا عباد الله المخلصين,4,لكن عباد الله مخلص
3992,37,170,فكفروا به فسوف يعلمون,4,كفر ب سوف علم
3993,37,171,ولقد سبقت كلمتنا لعبادنا المرسلين,5,قد سبق كلمة عباد مرسل
3994,37,172,إنهم لهم المنصورون,3,إن ل منصور
3995,37,173,وإن جندنا لهم الغالبون,4,إن جند ل غالب
3996,37,174,فتول عنهم حتى حين,4,تولي عن حتى حين
3997,37,175,وأبصرهم فسوف يبصرون,3,أبصر سوف أبصر
3998,37,176,أفبعذابنا يستعجلون,2,أفبعذابنا استعجل
3999,37,177,فإذا نزل بساحتهم فساء صباح المنذرين,6,إذا نزل ساحة فساء صباح منذر
4000,37,178,وتول عنهم حتى حين,4,أولى عن حتى حين
4001,37,179,وأبصر فسوف يبصرون,3,أبصر سوف أبصر
4002,37,180,سبحان ربك رب العزة عما يصفون,6,سبحان رب رب عزة عن وصف
4003,37,181,وسلام على المرسلين,3,سلام على مرسل
4004,37,182,والحمد لله رب العالمين,4,حمد الله رب عالم
4005,38,0,بسم الله الرحمن الرحيم,4,بسم الله رحمن رحيم
4006,38,1,ص والقران ذي الذكر,4,ص قران ذو ذكر
4007,38,2,بل الذين كفروا في عزة وشقاق,6,بل الذي كفر في عزة شقاق
4008,38,3,كم أهلكنا من قبلهم من قرن فنادوا ولات حين مناص,10,كم أهلك من قبل من قرن نادى لا حين مناص
4009,38,4,وعجبوا أن جاءهم منذر منهم وقال الكافرون هذا ساحر كذاب,10,عجب أن جاء منذر من قال كافر هذا ساحر كذاب
4010,38,5,أجعل الالهة إلها واحدا إن هذا لشيء عجاب,8,جعل اله إله واحد إن هذا شيء عجاب
4011,38,6,وانطلق الملأ منهم أن امشوا واصبروا على الهتكم إن هذا لشيء يراد,12,انطلق ملأ من أن امش اصبر على اله إن هذا شيء أراد
4012,38,7,ما سمعنا بهذا في الملة الاخرة إن هذا إلا اختلاق,10,ما سمع هذا في ملة اخر إن هذا إلا اختلاق
4013,38,8,أأنزل عليه الذكر من بيننا بل هم في شك من ذكري بل لما يذوقوا عذاب,15,أأنزل على ذكر من بين بل هم في شك من ذكر بل ما ذاق عذاب
4014,38,9,أم عندهم خزائن رحمة ربك العزيز الوهاب,7,أم عند خزانة رحمة رب عزيز وهاب
4015,38,10,أم لهم ملك السماوات والأرض وما بينهما فليرتقوا في الأسباب,10,أم ل ملك سماء أرض ما بين ارتقى في سبب
4016,38,11,جند ما هنالك مهزوم من الأحزاب,6,جند ما هناك مهزوم من حزب
4017,38,12,كذبت قبلهم قوم نوح وعاد وفرعون ذو الأوتاد,8,كذب قبل قوم نوح عادي فرعون ذو أوتاد
4018,38,13,وثمود وقوم لوط وأصحاب الأيكة أولئك الأحزاب,7,ثمود قوم لوط صاحب أيكة أولائك حزب
4019,38,14,إن كل إلا كذب الرسل فحق عقاب,7,إن كل إلا كذب رسول حق عقاب
4020,38,15,وما ينظر هؤلاء إلا صيحة واحدة ما لها من فواق,10,ما نظر هذا إلا صيحة واحد ما ل من فواق
4021,38,16,وقالوا ربنا عجل لنا قطنا قبل يوم الحساب,8,قال رب عجل ل قطن قبل يوم حساب
4022,38,17,اصبر على ما يقولون واذكر عبدنا داوود ذا الأيد إنه أواب,11,اصبر على ما قال ذكر عبد داوود ذو أيد إن أواب
4023,38,18,إنا سخرنا الجبال معه يسبحن بالعشي والإشراق,7,إن سخر جبل مع يسبحن عشي إشراق
4024,38,19,والطير محشورة كل له أواب,5,طير محشورة كل ل أواب
4025,38,20,وشددنا ملكه واتيناه الحكمة وفصل الخطاب,6,شد ملك واتي حكمة فصل خطاب
4026,38,21,وهل أتاك نبأ الخصم إذ تسوروا المحراب,7,هل أتى نبأ خصم إذ تسور محراب
4027,38,22,إذ دخلوا على داوود ففزع منهم قالوا لا تخف خصمان بغى بعضنا على بعض فاحكم بيننا بالحق ولا تشطط واهدنا إلى سواء الصراط,23,إذ دخل على داوود فزع من قال لا أخفى خصم بغى بعض على بعض احكم بين حق لا تشطط اهد إلى سواء صراط
4028,38,23,إن هذا أخي له تسع وتسعون نعجة ولي نعجة واحدة فقال أكفلنيها وعزني في الخطاب,15,إن هذا أخ ل تسع تسعون نعجة ولي نعجة واحد قال أكفلنيها عزني في خطاب
4029,38,24,قال لقد ظلمك بسؤال نعجتك إلى نعاجه وإن كثيرا من الخلطاء ليبغي بعضهم على بعض إلا الذين امنوا وعملوا الصالحات وقليل ما هم وظن داوود أنما فتناه فاستغفر ربه وخر راكعا وأناب,32,قال قد ظلم سؤال نعجة إلى نعجة إن كثير من خليط بغى بعض على بعض إلا الذي امن عمل صالح قليل ما هم ظن داوود أنما تناه استغفر رب خر راكع أناب
4030,38,25,فغفرنا له ذلك وإن له عندنا لزلفى وحسن ماب,9,غفر ل ذلك إن ل عند زلفى حسن ماب
4031,38,26,يا داوود إنا جعلناك خليفة في الأرض فاحكم بين الناس بالحق ولا تتبع الهوى فيضلك عن سبيل الله إن الذين يضلون عن سبيل الله لهم عذاب شديد بما نسوا يوم الحساب,31,يا داوود إن جعل خليفة في أرض احكم بين ناس حق لا تبع هوى أضل عن سبيل الله إن الذي ضل عن سبيل الله ل عذاب شديد ما نسي يوم حساب
4032,38,27,وما خلقنا السماء والأرض وما بينهما باطلا ذلك ظن الذين كفروا فويل للذين كفروا من النار,16,ما خلق سماء أرض ما بين باطل ذلك ظن الذي كفر ويل الذي كفر من نار
4033,38,28,أم نجعل الذين امنوا وعملوا الصالحات كالمفسدين في الأرض أم نجعل المتقين كالفجار,13,أم جعل الذي امن عمل صالح مفسد في أرض أم جعل متقي فاجر
4034,38,29,كتاب أنزلناه إليك مبارك ليدبروا اياته وليتذكر أولو الألباب,9,كتاب أنزل إلى مبارك دبر ايا تذكر أولو لب
4035,38,30,ووهبنا لداوود سليمان نعم العبد إنه أواب,7,وهب داوود سليمان نعم عبد إن أواب
4036,38,31,إذ عرض عليه بالعشي الصافنات الجياد,6,إذ عرض على عشي صافن جيد
4037,38,32,فقال إني أحببت حب الخير عن ذكر ربي حتى توارت بالحجاب,11,قال إن أحب حب خير عن ذكر رب حتى توارى حجاب
4038,38,33,ردوها علي فطفق مسحا بالسوق والأعناق,6,رد علي طفق مسح سوق عنق
4039,38,34,ولقد فتنا سليمان وألقينا على كرسيه جسدا ثم أناب,9,قد فتنة سليمان ألقى على كرسي جسد ثم أناب
4040,38,35,قال رب اغفر لي وهب لي ملكا لا ينبغي لأحد من بعدي إنك أنت الوهاب,15,قال رب اغفر ل وهب ل ملك لا انبغى أحد من بعد إن أنت وهاب
4041,38,36,فسخرنا له الريح تجري بأمره رخاء حيث أصاب,8,سخر ل ريح جرى أمر رخاء حيث أصاب
4042,38,37,والشياطين كل بناء وغواص,4,شيطان كل بناء غواص
4043,38,38,واخرين مقرنين في الأصفاد,4,آخر مقرن في صفد
4044,38,39,هذا عطاؤنا فامنن أو أمسك بغير حساب,7,هذا عطاء فامنن أو أمسك غير حساب
4045,38,40,وإن له عندنا لزلفى وحسن ماب,6,إن ل عند زلفى حسن ماب
4046,38,41,واذكر عبدنا أيوب إذ نادى ربه أني مسني الشيطان بنصب وعذاب,11,ذكر عبد أيوب إذ نادى رب أن مس شيطان نصب عذاب
4047,38,42,اركض برجلك هذا مغتسل بارد وشراب,6,اركض رجل هذا مغتسل بارد شراب
4048,38,43,ووهبنا له أهله ومثلهم معهم رحمة منا وذكرى لأولي الألباب,10,وهب ل أهل مثل مع رحمة من ذكرى أولى لب
4049,38,44,وخذ بيدك ضغثا فاضرب به ولا تحنث إنا وجدناه صابرا نعم العبد إنه أواب,14,أخذ بيد ضغث اضرب ب لا تحنث إن وجد صابر نعم عبد إن أواب
4050,38,45,واذكر عبادنا إبراهيم وإسحاق ويعقوب أولي الأيدي والأبصار,8,ذكر عباد إبراهيم إسحاق يعقوب أولى يد أبصار
4051,38,46,إنا أخلصناهم بخالصة ذكرى الدار,5,إن أخلصناهم خالص ذكرى دار
4052,38,47,وإنهم عندنا لمن المصطفين الأخيار,5,إن عند من مصطفى خير
4053,38,48,واذكر إسماعيل واليسع وذا الكفل وكل من الأخيار,8,ذكر إسماعيل وسع ذو كفل كل من خير
4054,38,49,هذا ذكر وإن للمتقين لحسن ماب,6,هذا ذكر إن متقي حسن ماب
4055,38,50,جنات عدن مفتحة لهم الأبواب,5,جنة عدن مفتح ل باب
4056,38,51,متكئين فيها يدعون فيها بفاكهة كثيرة وشراب,7,متكئ في دعا في فاكهة كثير شراب
4057,38,52,وعندهم قاصرات الطرف أتراب,4,عند قاصر طرف أتراب
4058,38,53,هذا ما توعدون ليوم الحساب,5,هذا ما وعد يوم حساب
4059,38,54,إن هذا لرزقنا ما له من نفاد,7,إن هذا رزق ما ل من نفاد
4060,38,55,هذا وإن للطاغين لشر ماب,5,هذا إن طاغي شر ماب
4061,38,56,جهنم يصلونها فبئس المهاد,4,جهنم صلى بئس مهاد
4062,38,57,هذا فليذوقوه حميم وغساق,4,هذا فليذوقوه حميم غساق
4063,38,58,واخر من شكله أزواج,4,آخر من شكل زوج
4064,38,59,هذا فوج مقتحم معكم لا مرحبا بهم إنهم صالو النار,10,هذا فوج مقتحم مع لا مرحبا ب إن صالو نار
4065,38,60,قالوا بل أنتم لا مرحبا بكم أنتم قدمتموه لنا فبئس القرار,11,قال بل أنتم لا مرحبا ب أنتم قدمتموه ل بئس قرار
4066,38,61,قالوا ربنا من قدم لنا هذا فزده عذابا ضعفا في النار,11,قال رب من قدم ل هذا زده عذاب ضعف في نار
4067,38,62,وقالوا ما لنا لا نرى رجالا كنا نعدهم من الأشرار,10,قال ما ل لا رأى رجل كان عد من شرير
4068,38,63,أتخذناهم سخريا أم زاغت عنهم الأبصار,6,أتخذناهم سخري أم زاغ عن أبصار
4069,38,64,إن ذلك لحق تخاصم أهل النار,6,إن ذلك لحق خاصم أهل نار
4070,38,65,قل إنما أنا منذر وما من إله إلا الله الواحد القهار,11,قال إن أنا منذر ما من إله إلا الله واحد قهار
4071,38,66,رب السماوات والأرض وما بينهما العزيز الغفار,7,رب سماء أرض ما بين عزيز غفار
4072,38,67,قل هو نبأ عظيم,4,قال هو نبأ عظيم
4073,38,68,أنتم عنه معرضون,3,أنتم عن معرض
4074,38,69,ما كان لي من علم بالملإ الأعلى إذ يختصمون,9,ما كان ل من علم ملإ أعلى إذ اختصم
4075,38,70,إن يوحى إلي إلا أنما أنا نذير مبين,8,إن وحى إلى إلا أنما أنا نذير مبين
4076,38,71,إذ قال ربك للملائكة إني خالق بشرا من طين,9,إذ قال رب ملأك إن خالق بشر من طين
4077,38,72,فإذا سويته ونفخت فيه من روحي فقعوا له ساجدين,9,إذا سوى نفخة في من روح فقع ل ساجد
4078,38,73,فسجد الملائكة كلهم أجمعون,4,سجد ملأك كل أجمع
4079,38,74,إلا إبليس استكبر وكان من الكافرين,6,إلا إبليس استكبر كان من كافر
4080,38,75,قال يا إبليس ما منعك أن تسجد لما خلقت بيدي أستكبرت أم كنت من العالين,15,قال يا إبليس ما منع أن سجد ما خلق بيد أستكبرت أم كان من عالي
4081,38,76,قال أنا خير منه خلقتني من نار وخلقته من طين,10,قال أنا خير من خلق من نار خلق من طين
4082,38,77,قال فاخرج منها فإنك رجيم,5,قال اخرج من إن رجيم
4083,38,78,وإن عليك لعنتي إلى يوم الدين,6,إن على لعنة إلى يوم دين
4084,38,79,قال رب فأنظرني إلى يوم يبعثون,6,قال رب فأنظرني إلى يوم بعث
4085,38,80,قال فإنك من المنظرين,4,قال إن من منظر
4086,38,81,إلى يوم الوقت المعلوم,4,إلى يوم وقت معلوم
4087,38,82,قال فبعزتك لأغوينهم أجمعين,4,قال فبعزتك لأغوينهم أجمع
4088,38,83,إلا عبادك منهم المخلصين,4,إلا عباد من مخلص
4089,38,84,قال فالحق والحق أقول,4,قال حق حق قال
4090,38,85,لأملأن جهنم منك وممن تبعك منهم أجمعين,7,لأملأن جهنم من من تبع من أجمع
4091,38,86,قل ما أسألكم عليه من أجر وما أنا من المتكلفين,10,قال ما سأل على من أجر ما أنا من متكلف
4092,38,87,إن هو إلا ذكر للعالمين,5,إن هو إلا ذكر عالم
4093,38,88,ولتعلمن نبأه بعد حين,4,تعلم نبأ بعد حين
4094,39,0,بسم الله الرحمن الرحيم,4,بسم الله رحمن رحيم
4095,39,1,تنزيل الكتاب من الله العزيز الحكيم,6,تنزيل كتاب من الله عزيز حكيم
4096,39,2,إنا أنزلنا إليك الكتاب بالحق فاعبد الله مخلصا له الدين,10,إن أنزل إلى كتاب حق فاعبد الله مخلص ل دين
4097,39,3,ألا لله الدين الخالص والذين اتخذوا من دونه أولياء ما نعبدهم إلا ليقربونا إلى الله زلفى إن الله يحكم بينهم في ما هم فيه يختلفون إن الله لا يهدي من هو كاذب كفار,33,أن الله دين خالص الذي اتخذ من دون ولي ما عبد إلا ليقربونا إلى الله زلفى إن الله حكم بين في ما هم في اختلف إن الله لا هدى من هو كاذب كافر
4098,39,4,لو أراد الله أن يتخذ ولدا لاصطفى مما يخلق ما يشاء سبحانه هو الله الواحد القهار,16,لو أراد الله أن اتخذ ولد اصطفى من خلق ما شاء سبحان هو الله واحد قهار
4099,39,5,خلق السماوات والأرض بالحق يكور الليل على النهار ويكور النهار على الليل وسخر الشمس والقمر كل يجري لأجل مسمى ألا هو العزيز الغفار,23,خلق سماء أرض حق يكور ليل على نهار يكور نهار على ليل سخر شمس قمر كل جرى أجل مسمى أن هو عزيز غفار
4100,39,6,خلقكم من نفس واحدة ثم جعل منها زوجها وأنزل لكم من الأنعام ثمانية أزواج يخلقكم في بطون أمهاتكم خلقا من بعد خلق في ظلمات ثلاث ذلكم الله ربكم له الملك لا إله إلا هو فأنى تصرفون,36,خلق من نفس واحد ثم جعل من زوج أنزل ل من أنعام ثماني زوج خلق في بطون أم خلق من بعد خلق في ظلم ثلاث ذلك الله رب ل ملك لا إله إلا هو أنى تصرف
4101,39,7,إن تكفروا فإن الله غني عنكم ولا يرضى لعباده الكفر وإن تشكروا يرضه لكم ولا تزر وازرة وزر أخرى ثم إلى ربكم مرجعكم فينبئكم بما كنتم تعملون إنه عليم بذات الصدور,31,إن كفر إن الله غني عن لا رضي عباد كفر إن شكر رض ل لا وزر وازرة وزر آخر ثم إلى رب مرجع فينبئكم ما كان عمل إن عليم ذات صدر
4102,39,8,وإذا مس الإنسان ضر دعا ربه منيبا إليه ثم إذا خوله نعمة منه نسي ما كان يدعو إليه من قبل وجعل لله أندادا ليضل عن سبيله قل تمتع بكفرك قليلا إنك من أصحاب النار,34,إذا مس إنسان ضر دعا رب منيب إلى ثم إذا خول نعمة من نسي ما كان دعا إلى من قبل جعل الله ند أضل عن سبيل قال تمتع كفر قليل إن من صاحب نار
4103,39,9,أمن هو قانت اناء الليل ساجدا وقائما يحذر الاخرة ويرجو رحمة ربه قل هل يستوي الذين يعلمون والذين لا يعلمون إنما يتذكر أولو الألباب,24,أمن هو قانئ اناء ليل ساجد قائم حذر اخر رجا رحمة رب قال هل استوى الذي علم الذي لا علم إن تذكر أولو لب
4104,39,10,قل يا عباد الذين امنوا اتقوا ربكم للذين أحسنوا في هذه الدنيا حسنة وأرض الله واسعة إنما يوفى الصابرون أجرهم بغير حساب,22,قال يا عباد الذي امن اتقى رب الذي أحسن في هذا دنيا حسن أرض الله واسع إن وفى صابر أجر غير حساب
4105,39,11,قل إني أمرت أن أعبد الله مخلصا له الدين,9,قال إن أمر أن عبد الله مخلص ل دين
4106,39,12,وأمرت لأن أكون أول المسلمين,5,أمر أن كان أول مسلم
4107,39,13,قل إني أخاف إن عصيت ربي عذاب يوم عظيم,9,قال إن خاف إن عصى رب عذاب يوم عظيم
4108,39,14,قل الله أعبد مخلصا له ديني,6,قال الله عبد مخلص ل ديني
4109,39,15,فاعبدوا ما شئتم من دونه قل إن الخاسرين الذين خسروا أنفسهم وأهليهم يوم القيامة ألا ذلك هو الخسران المبين,19,فاعبدوا ما شاء من دون قال إن خاسر الذي خسر نفس أهل يوم قيامة أن ذلك هو خسران مبين
4110,39,16,لهم من فوقهم ظلل من النار ومن تحتهم ظلل ذلك يخوف الله به عباده يا عباد فاتقون,17,ل من فوق ظلل من نار من تحت ظلل ذلك خوف الله ب عباد يا عباد اتق
4111,39,17,والذين اجتنبوا الطاغوت أن يعبدوها وأنابوا إلى الله لهم البشرى فبشر عباد,12,الذي اجتنب طاغوت أن يعبدوها أناب إلى الله ل بشرة بشر عباد
4112,39,18,الذين يستمعون القول فيتبعون أحسنه أولئك الذين هداهم الله وأولئك هم أولو الألباب,13,الذي استمع قول اتبع أحسن أولائك الذي هدى الله أولائك هم أولو لب
4113,39,19,أفمن حق عليه كلمة العذاب أفأنت تنقذ من في النار,10,أفمن حق على كلمة عذاب أفأنت أنقذ من في نار
4114,39,20,لكن الذين اتقوا ربهم لهم غرف من فوقها غرف مبنية تجري من تحتها الأنهار وعد الله لا يخلف الله الميعاد,20,لكن الذي اتقى رب ل غرفة من فوق غرفة مبني جرى من تحت نهر وعد الله لا خلف الله ميعاد
4115,39,21,ألم تر أن الله أنزل من السماء ماء فسلكه ينابيع في الأرض ثم يخرج به زرعا مختلفا ألوانه ثم يهيج فتراه مصفرا ثم يجعله حطاما إن في ذلك لذكرى لأولي الألباب,31,ألم رأى أن الله أنزل من سماء ماء سلك ينبوع في أرض ثم خرج ب زرع مختلف لون ثم هاج فتر مصفر ثم جعل حطام إن في ذلك ذكرى أولى لب
4116,39,22,أفمن شرح الله صدره للإسلام فهو على نور من ربه فويل للقاسية قلوبهم من ذكر الله أولئك في ضلال مبين,20,أفمن شرح الله صدر إسلام هو على نور من رب ويل قاسي قلب من ذكر الله أولائك في ضلال مبين
4117,39,23,الله نزل أحسن الحديث كتابا متشابها مثاني تقشعر منه جلود الذين يخشون ربهم ثم تلين جلودهم وقلوبهم إلى ذكر الله ذلك هدى الله يهدي به من يشاء ومن يضلل الله فما له من هاد,34,الله نزل أحسن حديث كتاب متشابه مثاني تقشعر من جلود الذي خشي رب ثم تلين جلود قلب إلى ذكر الله ذلك هدى الله هدى ب من شاء من أضل الله ما ل من هادي
4118,39,24,أفمن يتقي بوجهه سوء العذاب يوم القيامة وقيل للظالمين ذوقوا ما كنتم تكسبون,13,أفمن اتقى وجه سوء عذاب يوم قيامة قال ظالم ذوق ما كان كسب
