,chapter_num,verse_num,verse,length,stemmed
2301,19,35,ما كان لله أن يتخذ من ولد سبحانه إذا قضى أمرا فإنما يقول له كن فيكون,16,ما كان الله أن اتخذ من ولد سبحان إذا قضى أمر إن قال ل كان كان
2302,19,36,وإن الله ربي وربكم فاعبدوه هذا صراط مستقيم,8,إن الله رب رب فاعبدوه هذا صراط مستقيم
2303,19,37,فاختلف الأحزاب من بينهم فويل للذين كفروا من مشهد يوم عظيم,11,اختلف حزب من بين ويل الذي كفر من مشهد يوم عظيم
2304,19,38,أسمع بهم وأبصر يوم يأتوننا لكن الظالمون اليوم في ضلال مبين,11,سمع ب أبصر يوم أتى لكن ظالم يوم في ضلال مبين
2305,19,39,وأنذرهم يوم الحسرة إذ قضي الأمر وهم في غفلة وهم لا يؤمنون,12,نذر يوم حسرة إذ قضي أمر هم في غفلة هم لا آمن
2306,19,40,إنا نحن نرث الأرض ومن عليها وإلينا يرجعون,8,إن نحن ورث أرض من على إلى رجع
2307,19,41,واذكر في الكتاب إبراهيم إنه كان صديقا نبيا,8,ذكر في كتاب إبراهيم إن كان صديق نبي
2308,19,42,إذ قال لأبيه يا أبت لم تعبد ما لا يسمع ولا يبصر ولا يغني عنك شيئا,16,إذ قال أبيه يا أبى لم عبد ما لا سمع لا أبصر لا أغنى عن شيء
2309,19,43,يا أبت إني قد جاءني من العلم ما لم يأتك فاتبعني أهدك صراطا سويا,14,يا أبى إن قد جاء من علم ما لم أتى فاتبعني أهد صراط سوي
2310,19,44,يا أبت لا تعبد الشيطان إن الشيطان كان للرحمن عصيا,10,يا أبى لا عبد شيطان إن شيطان كان رحمن عصي
2311,19,45,يا أبت إني أخاف أن يمسك عذاب من الرحمن فتكون للشيطان وليا,12,يا أبى إن خاف أن أمسك عذاب من رحمن كان شيطان ولي
2312,19,46,قال أراغب أنت عن الهتي يا إبراهيم لئن لم تنته لأرجمنك واهجرني مليا,13,قال أراغب أنت عن هتي يا إبراهيم إن لم انتهى لأرجمنك اهجرني ملي
2313,19,47,قال سلام عليك سأستغفر لك ربي إنه كان بي حفيا,10,قال سلام على استغفر ل رب إن كان بي حفي
2314,19,48,وأعتزلكم وما تدعون من دون الله وأدعو ربي عسى ألا أكون بدعاء ربي شقيا,14,وأعتزلكم ما دعا من دون الله دعا رب عسى أن كان دعاء رب شقي
2315,19,49,فلما اعتزلهم وما يعبدون من دون الله وهبنا له إسحاق ويعقوب وكلا جعلنا نبيا,14,لما اعتزل ما عبد من دون الله وهب ل إسحاق يعقوب كلا جعل نبي
2316,19,50,ووهبنا لهم من رحمتنا وجعلنا لهم لسان صدق عليا,9,وهب ل من رحمة جعل ل لسان صدق علي
2317,19,51,واذكر في الكتاب موسى إنه كان مخلصا وكان رسولا نبيا,10,ذكر في كتاب موسى إن كان مخلص كان رسول نبي
2318,19,52,وناديناه من جانب الطور الأيمن وقربناه نجيا,7,نادي من جانب طور أيمن قرب نجي
2319,19,53,ووهبنا له من رحمتنا أخاه هارون نبيا,7,وهب ل من رحمة أخ هارون نبي
2320,19,54,واذكر في الكتاب إسماعيل إنه كان صادق الوعد وكان رسولا نبيا,11,ذكر في كتاب إسماعيل إن كان صادق وعد كان رسول نبي
2321,19,55,وكان يأمر أهله بالصلاة والزكاة وكان عند ربه مرضيا,9,كان أمر أهل صلاة زكاة كان عند رب مرضي
2322,19,56,واذكر في الكتاب إدريس إنه كان صديقا نبيا,8,ذكر في كتاب إدريس إن كان صديق نبي
2323,19,57,ورفعناه مكانا عليا,3,رفع مكان علي
2324,19,58,أولئك الذين أنعم الله عليهم من النبيين من ذرية ادم وممن حملنا مع نوح ومن ذرية إبراهيم وإسرائيل وممن هدينا واجتبينا إذا تتلى عليهم ايات الرحمن خروا سجدا وبكيا,29,أولائك الذي أنعم الله على من نبي من ذري ادم من حمل مع نوح من ذري إبراهيم إسرائيل من هدي اجتبى إذا تلا على ايا رحمن خر ساجد بكى
2325,19,59,فخلف من بعدهم خلف أضاعوا الصلاة واتبعوا الشهوات فسوف يلقون غيا,11,خلف من بعد خلف أضاع صلاة اتبع شهوة سوف ألقى غي
2326,19,60,إلا من تاب وامن وعمل صالحا فأولئك يدخلون الجنة ولا يظلمون شيئا,12,إلا من تاب أمن عمل صالح أولائك دخل جنة لا ظلم شيء
2327,19,61,جنات عدن التي وعد الرحمن عباده بالغيب إنه كان وعده مأتيا,11,جنة عدن الذي وعد رحمن عباد غيب إن كان وعد مأتي
2328,19,62,لا يسمعون فيها لغوا إلا سلاما ولهم رزقهم فيها بكرة وعشيا,11,لا سمع في لغو إلا سلام ل رزق في بكرة عشي
2329,19,63,تلك الجنة التي نورث من عبادنا من كان تقيا,9,ذلك جنة الذي ورث من عباد من كان تقي
2330,19,64,وما نتنزل إلا بأمر ربك له ما بين أيدينا وما خلفنا وما بين ذلك وما كان ربك نسيا,18,ما نتنزل إلا أمر رب ل ما بين يد ما خلف ما بين ذلك ما كان رب نسي
2331,19,65,رب السماوات والأرض وما بينهما فاعبده واصطبر لعبادته هل تعلم له سميا,12,رب سماء أرض ما بين فاعبده اصطبر عبادة هل تعلم ل سمي
2332,19,66,ويقول الإنسان أإذا ما مت لسوف أخرج حيا,8,قال إنسان أإذا ما مات سوف أخرج حي
2333,19,67,أولا يذكر الإنسان أنا خلقناه من قبل ولم يك شيئا,10,أول ذكر إنسان أنا خلق من قبل لم يك شيء
2334,19,68,فوربك لنحشرنهم والشياطين ثم لنحضرنهم حول جهنم جثيا,8,رب لنحشرنهم شيطان ثم لنحضرنهم حول جهنم جثي
2335,19,69,ثم لننزعن من كل شيعة أيهم أشد على الرحمن عتيا,10,ثم لننزعن من كل شيعة أي أشد على رحمن عتي
2336,19,70,ثم لنحن أعلم بالذين هم أولى بها صليا,8,ثم نحن أعلم الذي هم أولى ب صلي
2337,19,71,وإن منكم إلا واردها كان على ربك حتما مقضيا,9,إن من إلا وارد كان على رب حتم مقضي
2338,19,72,ثم ننجي الذين اتقوا ونذر الظالمين فيها جثيا,8,ثم نجى الذي اتقى نذر ظالم في جثي
2339,19,73,وإذا تتلى عليهم اياتنا بينات قال الذين كفروا للذين امنوا أي الفريقين خير مقاما وأحسن نديا,16,إذا تلا على اي بينة قال الذي كفر الذي امن أي فريق خير مقام أحسن ندي
2340,19,74,وكم أهلكنا قبلهم من قرن هم أحسن أثاثا ورئيا,9,كم أهلك قبل من قرن هم أحسن أثاث رئي
2341,19,75,قل من كان في الضلالة فليمدد له الرحمن مدا حتى إذا رأوا ما يوعدون إما العذاب وإما الساعة فسيعلمون من هو شر مكانا وأضعف جندا,25,قال من كان في ضلال فليمدد ل رحمن مد حتى إذا رأى ما وعد إما عذاب إما ساعة علم من هو شر مكان أضعف جند
2342,19,76,ويزيد الله الذين اهتدوا هدى والباقيات الصالحات خير عند ربك ثوابا وخير مردا,13,زاد الله الذي اهتد هدى باقي صالح خير عند رب ثواب خير مرد
2343,19,77,أفرأيت الذي كفر باياتنا وقال لأوتين مالا وولدا,8,أفرأيت الذي كفر باي قال أوى مال ولد
2344,19,78,أطلع الغيب أم اتخذ عند الرحمن عهدا,7,أطلع غيب أم اتخذ عند رحمن عهد
2345,19,79,كلا سنكتب ما يقول ونمد له من العذاب مدا,9,كلا كتب ما قال مد ل من عذاب مد
2346,19,80,ونرثه ما يقول ويأتينا فردا,5,ورث ما قال أتى فرد
2347,19,81,واتخذوا من دون الله الهة ليكونوا لهم عزا,8,اتخذ من دون الله اله كان ل عزا
2348,19,82,كلا سيكفرون بعبادتهم ويكونون عليهم ضدا,6,كلا كفر عبادة كان على ضد
2349,19,83,ألم تر أنا أرسلنا الشياطين على الكافرين تؤزهم أزا,9,ألم رأى أنا أرسل شيطان على كافر أز أز
2350,19,84,فلا تعجل عليهم إنما نعد لهم عدا,7,لا عجل على إن عد ل عدا
2351,19,85,يوم نحشر المتقين إلى الرحمن وفدا,6,يوم نحشر متقي إلى رحمن وفد
2352,19,86,ونسوق المجرمين إلى جهنم وردا,5,ساق مجرم إلى جهنم رد
2353,19,87,لا يملكون الشفاعة إلا من اتخذ عند الرحمن عهدا,9,لا ملك شفاعة إلا من اتخذ عند رحمن عهد
2354,19,88,وقالوا اتخذ الرحمن ولدا,4,قال اتخذ رحمن ولد
2355,19,89,لقد جئتم شيئا إدا,4,قد جاء شيء إد
2356,19,90,تكاد السماوات يتفطرن منه وتنشق الأرض وتخر الجبال هدا,9,كاد سماء يتفطرن من تنشق أرض خر جبل هدا
2357,19,91,أن دعوا للرحمن ولدا,4,أن دعا رحمن ولد
2358,19,92,وما ينبغي للرحمن أن يتخذ ولدا,6,ما انبغى رحمن أن اتخذ ولد
2359,19,93,إن كل من في السماوات والأرض إلا اتي الرحمن عبدا,10,إن كل من في سماء أرض إلا اتي رحمن عبد
2360,19,94,لقد أحصاهم وعدهم عدا,4,قد أحصا وعد عدا
2361,19,95,وكلهم اتيه يوم القيامة فردا,5,كل اتي يوم قيامة فرد
2362,19,96,إن الذين امنوا وعملوا الصالحات سيجعل لهم الرحمن ودا,9,إن الذي امن عمل صالح جعل ل رحمن ود
2363,19,97,فإنما يسرناه بلسانك لتبشر به المتقين وتنذر به قوما لدا,10,إن يسر لسان بشر ب متقي أنذر ب قوم دا
2364,19,98,وكم أهلكنا قبلهم من قرن هل تحس منهم من أحد أو تسمع لهم ركزا,14,كم أهلك قبل من قرن هل أحس من من أحد أو سمع ل ركز
2365,20,0,بسم الله الرحمن الرحيم,4,بسم الله رحمن رحيم
2366,20,1,طه,1,طه
2367,20,2,ما أنزلنا عليك القران لتشقى,5,ما أنزل على قران شقي
2368,20,3,إلا تذكرة لمن يخشى,4,إلا تذكرة من خشي
2369,20,4,تنزيلا ممن خلق الأرض والسماوات العلى,6,تنزيل من خلق أرض سماء على
2370,20,5,الرحمن على العرش استوى,4,رحمن على عرش استوى
2371,20,6,له ما في السماوات وما في الأرض وما بينهما وما تحت الثرى,12,ل ما في سماء ما في أرض ما بين ما تحت ثرى
2372,20,7,وإن تجهر بالقول فإنه يعلم السر وأخفى,7,إن جهر قول إن علم سر أخفى
2373,20,8,الله لا إله إلا هو له الأسماء الحسنى,8,الله لا إله إلا هو ل اسم أحسن
2374,20,9,وهل أتاك حديث موسى,4,هل أتى حديث موسى
2375,20,10,إذ رأى نارا فقال لأهله امكثوا إني انست نارا لعلي اتيكم منها بقبس أو أجد على النار هدى,18,إذ رأى نار قال أهل امكث إن انس نار علي اتي من قبس أو وجد على نار هدى
2376,20,11,فلما أتاها نودي يا موسى,5,لما أتاه أودى يا موسى
2377,20,12,إني أنا ربك فاخلع نعليك إنك بالواد المقدس طوى,9,إن أنا رب فاخلع نعل إن واد مقدس طوى
2378,20,13,وأنا اخترتك فاستمع لما يوحى,5,أنا اختار استمع ما وحى
2379,20,14,إنني أنا الله لا إله إلا أنا فاعبدني وأقم الصلاة لذكري,11,إن أنا الله لا إله إلا أنا فاعبدني أقم صلاة ذكر
2380,20,15,إن الساعة اتية أكاد أخفيها لتجزى كل نفس بما تسعى,10,إن ساعة اتي كاد أخفى جزى كل نفس ما سعى
2381,20,16,فلا يصدنك عنها من لا يؤمن بها واتبع هواه فتردى,10,لا يصدنك عن من لا آمن ب اتبع هوى ردي
2382,20,17,وما تلك بيمينك يا موسى,5,ما ذلك يمين يا موسى
2383,20,18,قال هي عصاي أتوكأ عليها وأهش بها على غنمي ولي فيها مارب أخرى,13,قال هي عصا توكأ على أهش ب على غنم ولي في مارب آخر
2384,20,19,قال ألقها يا موسى,4,قال لقي يا موسى
2385,20,20,فألقاها فإذا هي حية تسعى,5,ألقى إذا هي حي سعى
2386,20,21,قال خذها ولا تخف سنعيدها سيرتها الأولى,7,قال أخذ لا أخفى أعاد سيرة أول
2387,20,22,واضمم يدك إلى جناحك تخرج بيضاء من غير سوء اية أخرى,11,اضمم يد إلى جناح خرج أبيض من غير سوء اية آخر
2388,20,23,لنريك من اياتنا الكبرى,4,لنريك من اي أكبر
2389,20,24,اذهب إلى فرعون إنه طغى,5,أذهب إلى فرعون إن طغى
2390,20,25,قال رب اشرح لي صدري,5,قال رب أشرح ل صدر
2391,20,26,ويسر لي أمري,3,يسر ل أمر
2392,20,27,واحلل عقدة من لساني,4,احلل عقدة من لسان
2393,20,28,يفقهوا قولي,2,فقه قول
2394,20,29,واجعل لي وزيرا من أهلي,5,اجعل ل وزير من أهلي
2395,20,30,هارون أخي,2,هارون أخ
2396,20,31,اشدد به أزري,3,اشدد ب أزر
2397,20,32,وأشركه في أمري,3,أشرك في أمر
2398,20,33,كي نسبحك كثيرا,3,كي سبح كثير
2399,20,34,ونذكرك كثيرا,2,ذكر كثير
2400,20,35,إنك كنت بنا بصيرا,4,إن كان ب بصير
2401,20,36,قال قد أوتيت سؤلك يا موسى,6,قال قد أوتي سؤل يا موسى
2402,20,37,ولقد مننا عليك مرة أخرى,5,قد من على مرة آخر
2403,20,38,إذ أوحينا إلى أمك ما يوحى,6,إذ أوحى إلى أم ما وحى
2404,20,39,أن اقذفيه في التابوت فاقذفيه في اليم فليلقه اليم بالساحل يأخذه عدو لي وعدو له وألقيت عليك محبة مني ولتصنع على عيني,22,أن اقذفي في تابوت فاقذفيه في أليم لقي أليم ساحل أخذ عدو ل عدو ل ألقى على محبة من صنع على عين
2405,20,40,إذ تمشي أختك فتقول هل أدلكم على من يكفله فرجعناك إلى أمك كي تقر عينها ولا تحزن وقتلت نفسا فنجيناك من الغم وفتناك فتونا فلبثت سنين في أهل مدين ثم جئت على قدر يا موسى,35,إذ مشى أخت قال هل دل على من كفل رجع إلى أم كي أقر عين لا حزن قتل نفس فنجيناك من غم فتن فتو لبث سنة في أهل مدين ثم جاء على قدر يا موسى
2406,20,41,واصطنعتك لنفسي,2,اصطنع نفس
2407,20,42,اذهب أنت وأخوك باياتي ولا تنيا في ذكري,8,أذهب أنت أخ باي لا ونى في ذكر
2408,20,43,اذهبا إلى فرعون إنه طغى,5,اذهب إلى فرعون إن طغى
2409,20,44,فقولا له قولا لينا لعله يتذكر أو يخشى,8,قول ل قول لينا لعل تذكر أو خشي
2410,20,45,قالا ربنا إننا نخاف أن يفرط علينا أو أن يطغى,10,قال رب إن خاف أن فرط على أو أن طغى
2411,20,46,قال لا تخافا إنني معكما أسمع وأرى,7,قال لا خاف إن مع سمع رأى
2412,20,47,فأتياه فقولا إنا رسولا ربك فأرسل معنا بني إسرائيل ولا تعذبهم قد جئناك باية من ربك والسلام على من اتبع الهدى,21,فأتياه قول إن رسول رب أرسل مع بنون إسرائيل لا عذب قد جاء باي من رب سلام على من اتبع هدى
2413,20,48,إنا قد أوحي إلينا أن العذاب على من كذب وتولى,10,إن قد أوحى إلى أن عذاب على من كذب تولى
2414,20,49,قال فمن ربكما يا موسى,5,قال من رب يا موسى
2415,20,50,قال ربنا الذي أعطى كل شيء خلقه ثم هدى,9,قال رب الذي أعطى كل شيء خلق ثم هدى
2416,20,51,قال فما بال القرون الأولى,5,قال ما بال قرن أول
2417,20,52,قال علمها عند ربي في كتاب لا يضل ربي ولا ينسى,11,قال علم عند رب في كتاب لا ضل رب لا نسي
2418,20,53,الذي جعل لكم الأرض مهدا وسلك لكم فيها سبلا وأنزل من السماء ماء فأخرجنا به أزواجا من نبات شتى,19,الذي جعل ل أرض مهد سلك ل في سبيل أنزل من سماء ماء أخرج ب زوج من نبات شتى
2419,20,54,كلوا وارعوا أنعامكم إن في ذلك لايات لأولي النهى,9,أكل ارع أنعام إن في ذلك اي أولى نهى
2420,20,55,منها خلقناكم وفيها نعيدكم ومنها نخرجكم تارة أخرى,8,من خلق في أعاد من أخرج تارة آخر
2421,20,56,ولقد أريناه اياتنا كلها فكذب وأبى,6,قد أرينا اي كل كذب أبى
2422,20,57,قال أجئتنا لتخرجنا من أرضنا بسحرك يا موسى,8,قال أجئتنا خرج من أرض سحر يا موسى
2423,20,58,فلنأتينك بسحر مثله فاجعل بيننا وبينك موعدا لا نخلفه نحن ولا أنت مكانا سوى,14,فلنأتينك سحر مثل فاجعل بين بين موعد لا نخلف نحن لا أنت مكان سوى
2424,20,59,قال موعدكم يوم الزينة وأن يحشر الناس ضحى,8,قال موعد يوم زينة أن حشر ناس ضحى
2425,20,60,فتولى فرعون فجمع كيده ثم أتى,6,تولى فرعون جمع كيد ثم أتى
2426,20,61,قال لهم موسى ويلكم لا تفتروا على الله كذبا فيسحتكم بعذاب وقد خاب من افترى,15,قال ل موسى ويل لا فتر على الله كذب فيسحتكم عذاب قد خاب من افترى
2427,20,62,فتنازعوا أمرهم بينهم وأسروا النجوى,5,تنازع أمر بين أسر نجوى
2428,20,63,قالوا إن هذان لساحران يريدان أن يخرجاكم من أرضكم بسحرهما ويذهبا بطريقتكم المثلى,13,قال إن هذا لساحران أراد أن يخرجاكم من أرض سحر ذهب طريقة أمثل
2429,20,64,فأجمعوا كيدكم ثم ائتوا صفا وقد أفلح اليوم من استعلى,10,أجمع كيد ثم ائتوا صف قد أفلح يوم من استعلى
2430,20,65,قالوا يا موسى إما أن تلقي وإما أن نكون أول من ألقى,12,قال يا موسى إما أن تلقي إما أن كان أول من ألقى
2431,20,66,قال بل ألقوا فإذا حبالهم وعصيهم يخيل إليه من سحرهم أنها تسعى,12,قال بل ألقى إذا حبل عصي خيل إلى من سحر أن سعى
2432,20,67,فأوجس في نفسه خيفة موسى,5,أوجس في نفس خيفة موسى
2433,20,68,قلنا لا تخف إنك أنت الأعلى,6,قال لا أخفى إن أنت أعلى
2434,20,69,وألق ما في يمينك تلقف ما صنعوا إنما صنعوا كيد ساحر ولا يفلح الساحر حيث أتى,16,لقي ما في يمين تلقف ما صنع إن صنع كيد ساحر لا أفلح ساحر حيث أتى
2435,20,70,فألقي السحرة سجدا قالوا امنا برب هارون وموسى,8,ألقى سحر ساجد قال أمن رب هارون موسى
2436,20,71,قال امنتم له قبل أن اذن لكم إنه لكبيركم الذي علمكم السحر فلأقطعن أيديكم وأرجلكم من خلاف ولأصلبنكم في جذوع النخل ولتعلمن أينا أشد عذابا وأبقى,26,قال امنتم ل قبل أن اذن ل إن كبير الذي علم سحر فلأقطعن يد رجل من خلاف ولأصلبنكم في جذع نخل تعلم أي أشد عذاب أبقى
2437,20,72,قالوا لن نؤثرك على ما جاءنا من البينات والذي فطرنا فاقض ما أنت قاض إنما تقضي هذه الحياة الدنيا,19,قال لن نؤثرك على ما جاء من بينة الذي فطر اقض ما أنت قاضي إن قضى هذا حياة دنيا
2438,20,73,إنا امنا بربنا ليغفر لنا خطايانا وما أكرهتنا عليه من السحر والله خير وأبقى,14,إن أمن رب غفر ل خطيئة ما أكرهتنا على من سحر الله خير أبقى
2439,20,74,إنه من يأت ربه مجرما فإن له جهنم لا يموت فيها ولا يحيى,13,إن من أتى رب مجرم إن ل جهنم لا مات في لا يحيى
2440,20,75,ومن يأته مؤمنا قد عمل الصالحات فأولئك لهم الدرجات العلى,10,من أتى مؤمن قد عمل صالح أولائك ل درجة على
2441,20,76,جنات عدن تجري من تحتها الأنهار خالدين فيها وذلك جزاء من تزكى,12,جنة عدن جرى من تحت نهر خالد في ذلك جزاء من زكى
2442,20,77,ولقد أوحينا إلى موسى أن أسر بعبادي فاضرب لهم طريقا في البحر يبسا لا تخاف دركا ولا تخشى,18,قد أوحى إلى موسى أن أسر عباد اضرب ل طريق في بحر يبس لا خاف درك لا خشي
2443,20,78,فأتبعهم فرعون بجنوده فغشيهم من اليم ما غشيهم,8,أتبع فرعون جندي غشي من أليم ما غشي
2444,20,79,وأضل فرعون قومه وما هدى,5,أضل فرعون قوم ما هدى
2445,20,80,يا بني إسرائيل قد أنجيناكم من عدوكم وواعدناكم جانب الطور الأيمن ونزلنا عليكم المن والسلوى,15,يا بنون إسرائيل قد أنجيناكم من عدو وواعدناكم جانب طور أيمن نزل على المن سلوى
2446,20,81,كلوا من طيبات ما رزقناكم ولا تطغوا فيه فيحل عليكم غضبي ومن يحلل عليه غضبي فقد هوى,17,أكل من طيب ما رزق لا تطغو في أحل على غضب من حلل على غضب قد هوى
2447,20,82,وإني لغفار لمن تاب وامن وعمل صالحا ثم اهتدى,9,إن غفار من تاب أمن عمل صالح ثم اهتدى
2448,20,83,وما أعجلك عن قومك يا موسى,6,ما أعجل عن قوم يا موسى
2449,20,84,قال هم أولاء على أثري وعجلت إليك رب لترضى,9,قال هم أولاء على أثري عجلة إلى رب رضي
2450,20,85,قال فإنا قد فتنا قومك من بعدك وأضلهم السامري,9,قال إن قد فتنة قوم من بعد أضل سامري
2451,20,86,فرجع موسى إلى قومه غضبان أسفا قال يا قوم ألم يعدكم ربكم وعدا حسنا أفطال عليكم العهد أم أردتم أن يحل عليكم غضب من ربكم فأخلفتم موعدي,27,رجع موسى إلى قوم غضبان أسف قال يا قوم ألم يعدكم رب وعد حسن أفطال على عهد أم أراد أن حل على غضب من رب فأخلفتم موعد
2452,20,87,قالوا ما أخلفنا موعدك بملكنا ولكنا حملنا أوزارا من زينة القوم فقذفناها فكذلك ألقى السامري,15,قال ما أخلف موعد ملك لكن حمل وزر من زينة قوم فقذفناها كذلك ألقى سامري
2453,20,88,فأخرج لهم عجلا جسدا له خوار فقالوا هذا إلهكم وإله موسى فنسي,12,أخرج ل عجل جسد ل خوار قال هذا إله إله موسى نسي
2454,20,89,أفلا يرون ألا يرجع إليهم قولا ولا يملك لهم ضرا ولا نفعا,12,أفل رأى أن رجع إلى قول لا ملك ل ضر لا نفع
