,chapter_num,verse_num,verse,length,stemmed
1036,7,77,فعقروا الناقة وعتوا عن أمر ربهم وقالوا يا صالح ائتنا بما تعدنا إن كنت من المرسلين,16,عقر ناقة عتا عن أمر رب قال يا صالح ائتنا ما عد إن كان من مرسل
1037,7,78,فأخذتهم الرجفة فأصبحوا في دارهم جاثمين,6,أخذ رجفة أصبح في دار جاثم
1038,7,79,فتولى عنهم وقال يا قوم لقد أبلغتكم رسالة ربي ونصحت لكم ولكن لا تحبون الناصحين,15,تولى عن قال يا قوم قد أبلغ رسالة رب نصح ل لكن لا أحب ناصح
1039,7,80,ولوطا إذ قال لقومه أتأتون الفاحشة ما سبقكم بها من أحد من العالمين,13,لوط إذ قال قوم أتأتون فاحشة ما سبق ب من أحد من عالم
1040,7,81,إنكم لتأتون الرجال شهوة من دون النساء بل أنتم قوم مسرفون,11,إن أتى رجل شهوة من دون نساء بل أنتم قوم مسرف
1041,7,82,وما كان جواب قومه إلا أن قالوا أخرجوهم من قريتكم إنهم أناس يتطهرون,13,ما كان جواب قوم إلا أن قال أخرجوهم من قرية إن إنسان تطهر
1042,7,83,فأنجيناه وأهله إلا امرأته كانت من الغابرين,7,أنجى أهل إلا امرأة كان من غابر
1043,7,84,وأمطرنا عليهم مطرا فانظر كيف كان عاقبة المجرمين,8,مطر على مطر انظر كيف كان عاقبة مجرم
1044,7,85,وإلى مدين أخاهم شعيبا قال يا قوم اعبدوا الله ما لكم من إله غيره قد جاءتكم بينة من ربكم فأوفوا الكيل والميزان ولا تبخسوا الناس أشياءهم ولا تفسدوا في الأرض بعد إصلاحها ذلكم خير لكم إن كنتم مؤمنين,38,إلى مدين أخ شعيب قال يا قوم اعبد الله ما ل من إله غير قد جاء بينة من رب أوفى كيل ميزان لا بخس ناس شيء لا أفسد في أرض بعد إصلاح ذلك خير ل إن كان مؤمن
1045,7,86,ولا تقعدوا بكل صراط توعدون وتصدون عن سبيل الله من امن به وتبغونها عوجا واذكروا إذ كنتم قليلا فكثركم وانظروا كيف كان عاقبة المفسدين,24,لا قعد كل صراط وعد صد عن سبيل الله من أمن ب بغى عوج اذكر إذ كان قليل كثر انظر كيف كان عاقبة مفسد
1046,7,87,وإن كان طائفة منكم امنوا بالذي أرسلت به وطائفة لم يؤمنوا فاصبروا حتى يحكم الله بيننا وهو خير الحاكمين,19,إن كان طائفة من امن الذي أرسل ب طائفة لم آمن اصبر حتى حكم الله بين هو خير حاكم
1047,7,88,قال الملأ الذين استكبروا من قومه لنخرجنك يا شعيب والذين امنوا معك من قريتنا أو لتعودن في ملتنا قال أولو كنا كارهين,22,قال ملأ الذي استكبر من قوم لنخرجنك يا شعيب الذي امن مع من قرية أو تعودن في ملة قال أولو كان كاره
1048,7,89,قد افترينا على الله كذبا إن عدنا في ملتكم بعد إذ نجانا الله منها وما يكون لنا أن نعود فيها إلا أن يشاء الله ربنا وسع ربنا كل شيء علما على الله توكلنا ربنا افتح بيننا وبين قومنا بالحق وأنت خير الفاتحين,42,قد افترى على الله كذب إن عاد في ملة بعد إذ نجى الله من ما كان ل أن عاد في إلا أن شاء الله رب وسع رب كل شيء علم على الله توكل رب فتح بين بين قوم حق أنت خير فاتح
1049,7,90,وقال الملأ الذين كفروا من قومه لئن اتبعتم شعيبا إنكم إذا لخاسرون,12,قال ملأ الذي كفر من قوم إن اتبع شعيب إن إذا خاسر
1050,7,91,فأخذتهم الرجفة فأصبحوا في دارهم جاثمين,6,أخذ رجفة أصبح في دار جاثم
1051,7,92,الذين كذبوا شعيبا كأن لم يغنوا فيها الذين كذبوا شعيبا كانوا هم الخاسرين,13,الذي كذب شعيب كأن لم أغنى في الذي كذب شعيب كان هم خاسر
1052,7,93,فتولى عنهم وقال يا قوم لقد أبلغتكم رسالات ربي ونصحت لكم فكيف اسى على قوم كافرين,16,تولى عن قال يا قوم قد أبلغ رسالة رب نصح ل كيف اسى على قوم كافر
1053,7,94,وما أرسلنا في قرية من نبي إلا أخذنا أهلها بالبأساء والضراء لعلهم يضرعون,13,ما أرسل في قرية من نبي إلا أخذ أهل بأساء ضراء لعل يضرع
1054,7,95,ثم بدلنا مكان السيئة الحسنة حتى عفوا وقالوا قد مس اباءنا الضراء والسراء فأخذناهم بغتة وهم لا يشعرون,18,ثم بدل مكان سيئ حسن حتى عفو قال قد مس اباء ضراء سراء فأخذناهم بغتة هم لا شعر
1055,7,96,ولو أن أهل القرى امنوا واتقوا لفتحنا عليهم بركات من السماء والأرض ولكن كذبوا فأخذناهم بما كانوا يكسبون,18,لو أن أهل قرية امن اتقى فتح على بركات من سماء أرض لكن كذب فأخذناهم ما كان كسب
1056,7,97,أفأمن أهل القرى أن يأتيهم بأسنا بياتا وهم نائمون,9,أفأمن أهل قرية أن أتى بأس بيات هم نائم
1057,7,98,أوأمن أهل القرى أن يأتيهم بأسنا ضحى وهم يلعبون,9,أوأمن أهل قرية أن أتى بأس ضحى هم لعب
1058,7,99,أفأمنوا مكر الله فلا يأمن مكر الله إلا القوم الخاسرون,10,أفأمنوا مكر الله لا أمن مكر الله إلا قوم خاسر
1059,7,100,أولم يهد للذين يرثون الأرض من بعد أهلها أن لو نشاء أصبناهم بذنوبهم ونطبع على قلوبهم فهم لا يسمعون,19,أولم هدى الذي ورث أرض من بعد أهل أن لو نشاء أصبناهم ذنب طبع على قلب هم لا سمع
1060,7,101,تلك القرى نقص عليك من أنبائها ولقد جاءتهم رسلهم بالبينات فما كانوا ليؤمنوا بما كذبوا من قبل كذلك يطبع الله على قلوب الكافرين,23,ذلك قرية نقص على من نبأ قد جاء رسول بينة ما كان آمن ما كذب من قبل ذلك طبع الله على قلب كافر
1061,7,102,وما وجدنا لأكثرهم من عهد وإن وجدنا أكثرهم لفاسقين,9,ما وجد أكثر من عهد إن وجد أكثر فاسق
1062,7,103,ثم بعثنا من بعدهم موسى باياتنا إلى فرعون وملئه فظلموا بها فانظر كيف كان عاقبة المفسدين,16,ثم بعث من بعد موسى باي إلى فرعون ملأ ظلم ب انظر كيف كان عاقبة مفسد
1063,7,104,وقال موسى يا فرعون إني رسول من رب العالمين,9,قال موسى يا فرعون إن رسول من رب عالم
1064,7,105,حقيق على أن لا أقول على الله إلا الحق قد جئتكم ببينة من ربكم فأرسل معي بني إسرائيل,18,حقيق على أن لا قال على الله إلا حق قد جاء بينة من رب أرسل مع بنون إسرائيل
1065,7,106,قال إن كنت جئت باية فأت بها إن كنت من الصادقين,11,قال إن كان جاء باي فأ ب إن كان من صادق
1066,7,107,فألقى عصاه فإذا هي ثعبان مبين,6,ألقى عصا إذا هي ثعبان مبين
1067,7,108,ونزع يده فإذا هي بيضاء للناظرين,6,نزع يد إذا هي أبيض ناظر
1068,7,109,قال الملأ من قوم فرعون إن هذا لساحر عليم,9,قال ملأ من قوم فرعون إن هذا ساحر عليم
1069,7,110,يريد أن يخرجكم من أرضكم فماذا تأمرون,7,أراد أن أخرج من أرض ماذا أمر
1070,7,111,قالوا أرجه وأخاه وأرسل في المدائن حاشرين,7,قال أرج أخ أرسل في مدينة حاشرين
1071,7,112,يأتوك بكل ساحر عليم,4,أتى كل ساحر عليم
1072,7,113,وجاء السحرة فرعون قالوا إن لنا لأجرا إن كنا نحن الغالبين,11,جاء سحر فرعون قال إن ل أجر إن كان نحن غالب
1073,7,114,قال نعم وإنكم لمن المقربين,5,قال نعم إن من مقرب
1074,7,115,قالوا يا موسى إما أن تلقي وإما أن نكون نحن الملقين,11,قال يا موسى إما أن تلقي إما أن كان نحن ملق
1075,7,116,قال ألقوا فلما ألقوا سحروا أعين الناس واسترهبوهم وجاءوا بسحر عظيم,11,قال ألقى لما ألقى سحر عين ناس واسترهبوهم جاء سحر عظيم
1076,7,117,وأوحينا إلى موسى أن ألق عصاك فإذا هي تلقف ما يأفكون,11,أوحى إلى موسى أن لقي عصا إذا هي تلقف ما يأفكون
1077,7,118,فوقع الحق وبطل ما كانوا يعملون,6,وقع حق بطل ما كان عمل
1078,7,119,فغلبوا هنالك وانقلبوا صاغرين,4,غلب هناك انقلب صاغر
1079,7,120,وألقي السحرة ساجدين,3,ألقى سحر ساجد
1080,7,121,قالوا امنا برب العالمين,4,قال أمن رب عالم
1081,7,122,رب موسى وهارون,3,رب موسى هارون
1082,7,123,قال فرعون امنتم به قبل أن اذن لكم إن هذا لمكر مكرتموه في المدينة لتخرجوا منها أهلها فسوف تعلمون,19,قال فرعون امنتم ب قبل أن اذن ل إن هذا مكر مكرتموه في مدينة خرج من أهل سوف علم
1083,7,124,لأقطعن أيديكم وأرجلكم من خلاف ثم لأصلبنكم أجمعين,8,لأقطعن يد رجل من خلاف ثم لأصلبنكم أجمع
1084,7,125,قالوا إنا إلى ربنا منقلبون,5,قال إن إلى رب منقلب
1085,7,126,وما تنقم منا إلا أن امنا بايات ربنا لما جاءتنا ربنا أفرغ علينا صبرا وتوفنا مسلمين,16,ما تنقم من إلا أن أمن باي رب ما جاء رب أفرغ على صبر وفى مسلم
1086,7,127,وقال الملأ من قوم فرعون أتذر موسى وقومه ليفسدوا في الأرض ويذرك والهتك قال سنقتل أبناءهم ونستحيي نساءهم وإنا فوقهم قاهرون,21,قال ملأ من قوم فرعون أتذر موسى قوم أفسد في أرض يذرك هتك قال قتل ابن نستحيي نساء إن فوق قاهر
1087,7,128,قال موسى لقومه استعينوا بالله واصبروا إن الأرض لله يورثها من يشاء من عباده والعاقبة للمتقين,16,قال موسى قوم استعين الله اصبر إن أرض الله ورث من شاء من عباد عاقبة متقي
1088,7,129,قالوا أوذينا من قبل أن تأتينا ومن بعد ما جئتنا قال عسى ربكم أن يهلك عدوكم ويستخلفكم في الأرض فينظر كيف تعملون,22,قال أوذي من قبل أن أتى من بعد ما جاء قال عسى رب أن أهلك عدو ويستخلفكم في أرض نظر كيف عمل
1089,7,130,ولقد أخذنا ال فرعون بالسنين ونقص من الثمرات لعلهم يذكرون,10,قد أخذ ال فرعون سنة نقص من ثمر لعل ذكر
1090,7,131,فإذا جاءتهم الحسنة قالوا لنا هذه وإن تصبهم سيئة يطيروا بموسى ومن معه ألا إنما طائرهم عند الله ولكن أكثرهم لا يعلمون,22,إذا جاء حسن قال ل هذا إن أصاب سيئ طار موسى من مع أن إن طائر عند الله لكن أكثر لا علم
1091,7,132,وقالوا مهما تأتنا به من اية لتسحرنا بها فما نحن لك بمؤمنين,12,قال مهما أتى ب من اية سحر ب ما نحن ل مؤمن
1092,7,133,فأرسلنا عليهم الطوفان والجراد والقمل والضفادع والدم ايات مفصلات فاستكبروا وكانوا قوما مجرمين,13,أرسل على طوفان جراد قمل ضفدع دم ايا مفصلة استكبر كان قوم مجرم
1093,7,134,ولما وقع عليهم الرجز قالوا يا موسى ادع لنا ربك بما عهد عندك لئن كشفت عنا الرجز لنؤمنن لك ولنرسلن معك بني إسرائيل,23,لما وقع على رجز قال يا موسى ادع ل رب ما عهد عند إن كشف عن رجز لنؤمنن ل ولنرسلن مع بنون إسرائيل
1094,7,135,فلما كشفنا عنهم الرجز إلى أجل هم بالغوه إذا هم ينكثون,11,لما كشف عن رجز إلى أجل هم غوه إذا هم نكث
1095,7,136,فانتقمنا منهم فأغرقناهم في اليم بأنهم كذبوا باياتنا وكانوا عنها غافلين,11,انتقم من أغرق في أليم أن كذب باي كان عن غافل
1096,7,137,وأورثنا القوم الذين كانوا يستضعفون مشارق الأرض ومغاربها التي باركنا فيها وتمت كلمت ربك الحسنى على بني إسرائيل بما صبروا ودمرنا ما كان يصنع فرعون وقومه وما كانوا يعرشون,29,أورث قوم الذي كان يستضعف مشرق أرض مغارب الذي بارك في تم كلم رب أحسن على بنون إسرائيل ما صبر دمر ما كان صنع فرعون قوم ما كان يعرشون
1097,7,138,وجاوزنا ببني إسرائيل البحر فأتوا على قوم يعكفون على أصنام لهم قالوا يا موسى اجعل لنا إلها كما لهم الهة قال إنكم قوم تجهلون,24,جاوز بني إسرائيل بحر أتى على قوم عكف على صنم ل قال يا موسى اجعل ل إله كما ل اله قال إن قوم جهل
1098,7,139,إن هؤلاء متبر ما هم فيه وباطل ما كانوا يعملون,10,إن هذا متبر ما هم في باطل ما كان عمل
1099,7,140,قال أغير الله أبغيكم إلها وهو فضلكم على العالمين,9,قال غير الله أبغيكم إله هو فضل على عالم
1100,7,141,وإذ أنجيناكم من ال فرعون يسومونكم سوء العذاب يقتلون أبناءكم ويستحيون نساءكم وفي ذلكم بلاء من ربكم عظيم,18,إذ أنجيناكم من ال فرعون يسومونكم سوء عذاب قتل ابن استحيى نساء في ذلك بلاء من رب عظيم
1101,7,142,وواعدنا موسى ثلاثين ليلة وأتممناها بعشر فتم ميقات ربه أربعين ليلة وقال موسى لأخيه هارون اخلفني في قومي وأصلح ولا تتبع سبيل المفسدين,23,واعد موسى ثلاثون ليلة أتمم عشر تم ميقات رب أربعون ليلة قال موسى أخ هارون اخلفني في قومي أصلح لا تبع سبيل مفسد
1102,7,143,ولما جاء موسى لميقاتنا وكلمه ربه قال رب أرني أنظر إليك قال لن تراني ولكن انظر إلى الجبل فإن استقر مكانه فسوف تراني فلما تجلى ربه للجبل جعله دكا وخر موسى صعقا فلما أفاق قال سبحانك تبت إليك وأنا أول المؤمنين,41,لما جاء موسى ميقات لم رب قال رب أرني نظر إلى قال لن راوند لكن انظر إلى جبل إن استقر مكان سوف راوند لما تجلى رب جبل جعل دك خر موسى صعق لما أفاق قال سبحان بت إلى أنا أول مؤمن
1103,7,144,قال يا موسى إني اصطفيتك على الناس برسالاتي وبكلامي فخذ ما اتيتك وكن من الشاكرين,15,قال يا موسى إن اصطفى على ناس رسالة كلام أخذ ما اتي كان من شاكر
1104,7,145,وكتبنا له في الألواح من كل شيء موعظة وتفصيلا لكل شيء فخذها بقوة وأمر قومك يأخذوا بأحسنها سأريكم دار الفاسقين,20,كتاب ل في لوح من كل شيء موعظة تفصيل كل شيء أخذ قوة أمر قوم أخذ أحسن سأر دار فاسق
1105,7,146,سأصرف عن اياتي الذين يتكبرون في الأرض بغير الحق وإن يروا كل اية لا يؤمنوا بها وإن يروا سبيل الرشد لا يتخذوه سبيلا وإن يروا سبيل الغي يتخذوه سبيلا ذلك بأنهم كذبوا باياتنا وكانوا عنها غافلين,36,صرف عن ايا الذي تكبر في أرض غير حق إن رأى كل اية لا آمن ب إن رأى سبيل رشد لا يتخذوه سبيل إن رأى سبيل غي يتخذوه سبيل ذلك أن كذب باي كان عن غافل
1106,7,147,والذين كذبوا باياتنا ولقاء الاخرة حبطت أعمالهم هل يجزون إلا ما كانوا يعملون,13,الذي كذب باي لقاء اخر حبط عمل هل جاز إلا ما كان عمل
1107,7,148,واتخذ قوم موسى من بعده من حليهم عجلا جسدا له خوار ألم يروا أنه لا يكلمهم ولا يهديهم سبيلا اتخذوه وكانوا ظالمين,22,اتخذ قوم موسى من بعد من حل عجل جسد ل خوار ألم رأى أن لا كلم لا هدى سبيل اتخذ كان ظالم
1108,7,149,ولما سقط في أيديهم ورأوا أنهم قد ضلوا قالوا لئن لم يرحمنا ربنا ويغفر لنا لنكونن من الخاسرين,18,لما سقط في يد رأى أن قد ضل قال إن لم رحم رب غفر ل لنكونن من خاسر
1109,7,150,ولما رجع موسى إلى قومه غضبان أسفا قال بئسما خلفتموني من بعدي أعجلتم أمر ربكم وألقى الألواح وأخذ برأس أخيه يجره إليه قال ابن أم إن القوم استضعفوني وكادوا يقتلونني فلا تشمت بي الأعداء ولا تجعلني مع القوم الظالمين,39,لما رجع موسى إلى قوم غضبان أسف قال بئسما خلفتموني من بعد أعجلتم أمر رب ألقى لوح أخذ رأس أخ جر إلى قال ابن أم إن قوم استضعفوني كاد يقتلونني لا شمت بي عدو لا جعل مع قوم ظالم
1110,7,151,قال رب اغفر لي ولأخي وأدخلنا في رحمتك وأنت أرحم الراحمين,11,قال رب اغفر ل أخ أدخل في رحمة أنت رحم راحم
1111,7,152,إن الذين اتخذوا العجل سينالهم غضب من ربهم وذلة في الحياة الدنيا وكذلك نجزي المفترين,15,إن الذي اتخذ عجل نال غضب من رب ذلة في حياة دنيا ذلك نجز مفتري
1112,7,153,والذين عملوا السيئات ثم تابوا من بعدها وامنوا إن ربك من بعدها لغفور رحيم,14,الذي عمل سيئة ثم تاب من بعد امن إن رب من بعد غفور رحيم
1113,7,154,ولما سكت عن موسى الغضب أخذ الألواح وفي نسختها هدى ورحمة للذين هم لربهم يرهبون,15,لما سكت عن موسى غضب أخذ لوح في نسخة هدى رحمة الذي هم رب رهب
1114,7,155,واختار موسى قومه سبعين رجلا لميقاتنا فلما أخذتهم الرجفة قال رب لو شئت أهلكتهم من قبل وإياي أتهلكنا بما فعل السفهاء منا إن هي إلا فتنتك تضل بها من تشاء وتهدي من تشاء أنت ولينا فاغفر لنا وارحمنا وأنت خير الغافرين,41,اختار موسى قوم سبعون رجل ميقات لما أخذ رجفة قال رب لو شاء أهلك من قبل إيا أتهلكنا ما فعل سفيه من إن هي إلا فتنة ضل ب من شاء هدى من شاء أنت لينا فاغفر ل ارحم أنت خير غافر
1115,7,156,واكتب لنا في هذه الدنيا حسنة وفي الاخرة إنا هدنا إليك قال عذابي أصيب به من أشاء ورحمتي وسعت كل شيء فسأكتبها للذين يتقون ويؤتون الزكاة والذين هم باياتنا يؤمنون,30,اكتب ل في هذا دنيا حسن في اخر إن هد إلى قال عذاب أصاب ب من شاء رحمة وسع كل شيء كتب الذي اتقى آتى زكاة الذي هم باي آمن
1116,7,157,الذين يتبعون الرسول النبي الأمي الذي يجدونه مكتوبا عندهم في التوراة والإنجيل يأمرهم بالمعروف وينهاهم عن المنكر ويحل لهم الطيبات ويحرم عليهم الخبائث ويضع عنهم إصرهم والأغلال التي كانت عليهم فالذين امنوا به وعزروه ونصروه واتبعوا النور الذي أنزل معه أولئك هم المفلحون,43,الذي اتبع رسول نبي أمي الذي وجد مكتوب عند في توراة إنجيل أمر معروف نهى عن منكر حل ل طيب حرم على خبائث وضع عن إصر غل الذي كان على الذي امن ب وعزروه نصرو اتبع نور الذي أنزل مع أولائك هم مفلح
1117,7,158,قل يا أيها الناس إني رسول الله إليكم جميعا الذي له ملك السماوات والأرض لا إله إلا هو يحيي ويميت فامنوا بالله ورسوله النبي الأمي الذي يؤمن بالله وكلماته واتبعوه لعلكم تهتدون,32,قال يا أي ناس إن رسول الله إلى جميع الذي ل ملك سماء أرض لا إله إلا هو أحيى أمات امن الله رسول نبي أمي الذي آمن الله كلمة اتبع لعل اهتدى
1118,7,159,ومن قوم موسى أمة يهدون بالحق وبه يعدلون,8,من قوم موسى أمة أهدى حق ب عدل
1119,7,160,وقطعناهم اثنتي عشرة أسباطا أمما وأوحينا إلى موسى إذ استسقاه قومه أن اضرب بعصاك الحجر فانبجست منه اثنتا عشرة عينا قد علم كل أناس مشربهم وظللنا عليهم الغمام وأنزلنا عليهم المن والسلوى كلوا من طيبات ما رزقناكم وما ظلمونا ولكن كانوا أنفسهم يظلمون,43,قطع اثنتا عشر سبط أمة أوحى إلى موسى إذ استسقا قوم أن اضرب عصا حجر انبجس من اثنتا عشر عين قد علم كل إنسان مشرب ظلل على غمام أنزل على المن سلوى أكل من طيب ما رزق ما ظلمونا لكن كان نفس ظلم
1120,7,161,وإذ قيل لهم اسكنوا هذه القرية وكلوا منها حيث شئتم وقولوا حطة وادخلوا الباب سجدا نغفر لكم خطيئاتكم سنزيد المحسنين,20,إذ قال ل اسكن هذا قرية أكل من حيث شاء قال حط ادخل باب ساجد غفر ل خطيئ زاد محسن
1121,7,162,فبدل الذين ظلموا منهم قولا غير الذي قيل لهم فأرسلنا عليهم رجزا من السماء بما كانوا يظلمون,17,بدل الذي ظلم من قول غير الذي قال ل أرسل على رجز من سماء ما كان ظلم
1122,7,163,واسألهم عن القرية التي كانت حاضرة البحر إذ يعدون في السبت إذ تأتيهم حيتانهم يوم سبتهم شرعا ويوم لا يسبتون لا تأتيهم كذلك نبلوهم بما كانوا يفسقون,27,اسأل عن قرية الذي كان حاضر بحر إذ عد في سبت إذ أتى حوت يوم سب شرع يوم لا يسبتون لا أتى ذلك نبلو ما كان فسق
1123,7,164,وإذ قالت أمة منهم لم تعظون قوما الله مهلكهم أو معذبهم عذابا شديدا قالوا معذرة إلى ربكم ولعلهم يتقون,19,إذ قال أمة من لم وعظ قوم الله مهلك أو معذب عذاب شديد قال معذرة إلى رب لعل اتقى
1124,7,165,فلما نسوا ما ذكروا به أنجينا الذين ينهون عن السوء وأخذنا الذين ظلموا بعذاب بئيس بما كانوا يفسقون,18,لما نسي ما ذكر ب أنجي الذي ينهون عن سوء أخذ الذي ظلم عذاب بئيس ما كان فسق
